 ,Review,an_uong
142,"Hơi fail, nên cái này review để cho mọi người tham khảo, chứ k mang tính chất PR, ai k thích đọc thì có thể tắt luông, many thanks!
Bữa sáng t2 của tụi mình bắt đầu sau khoảnh 30' chạy xe từ LAB (tuyệt đỉnh) vào thành phố, trên đường tới Eo Gió (nhạt nhẽo). Quán này đc dân tình đi xong mách lại, sau bao nhiêu đau đầu cuối cùng 2 đứa quyết định ăn 1 món tên lạ hoắc cho thêm phần challenge :))
Phách ăn bún sứa k, còn mình ăn bún chả cá và sứa ^^ Cảm nhận của mình là bình thường, k ngon nhưng k dở, và giá thì khá đắt (35k/bát) ăn mãi k thấy hết ' Phách còn nhận xét là: Bây giờ mới biết là sứa có vị nước lọc ^^ Nước dùng nói chung cũng ổn, nhưng lạc cả hành phi cũng cứu cánh món này nhiều.
Mình rất là gét câu ăn 1 lần cho biết, nhưng với món này thì chắc có lẽ ăn tới vài lần nữa cũng chỉ tập xác định là ""ăn nhiều lần cho biết"", chỉ cần biết thôi, chứ chắc k có nhu cầu thèm da diết như nhiều nhiều nhiều món khác ^^
Điểm em: 5/10
#bunsua #búnsứa #búnchảcá #hreats #rivnfood #hrntrip #foody #foodyquynhon",3
143,"Chúng tôi là những thực khách lớn tuổi vào cuối tháng 8,chúng tôi đều có ghé 2 quán Ngọc liên và Phượng tèo.Cả 2 quán đều là quán lớn,sạch sẽ,mọi người trong nhóm chúng tôi đều hài lòng,ngon miệng,giá cả hợp lý(giá từ 25-35000 đồng\tô).Ngày hôm sau,nhóm chúng tôi được dân địa phương và khách du lịch giới thiệu đến quán bún cá THU ở 159 Nguyễn Huệ,sau khi ăn xong cả nhóm chúng tôi đều có tiếng nói chung là sẽ không bao giờ đến quán THU này lần thứ 2 nữa.VÌ chả cá thì cứng như đồ cũ,quán rất hạn chế rau cho khách,khi có khách xin thêm rau thì chị chủ quán(khoảng gần 70 tuổi)cười vui vẻ,giả lã: rau ở đây hiếm lắm.Giá tô bún ở quán THU này là 30.000đồng/tô trong khi đó cũng tô bún này ở quán Ngọc Liên,Phương Tèo chỉ có 25.000 đông/tô mà lại ngon hơn.",4
144,"quán này có quảng cáo tren trang bình định , voi lại cũng co quảng cáo nhiều, khách di lịch thường hay đến đây ăn , thực ra mà nói , bún bà này không ngon , nước dùng thì nhạt nguội ngắt, mình vào lúc nào nước lèo cũng nguội , bỏ rau sống vào mà cứ trơ trơ không chín, ăn tô bún chả ngon lành gì, được cái là quảng cáo rầm rộ tren mạng thôi, chứ mấy bạn ở xa tới khong biét mà nghe quảng cáo vào ăn quand này la 1 sai lầm",2
145,"Mình thường chỉ hay viết review tốt cho các quán và bỏ qua những quán không thích, nhưng hôm nay mình quá bức xúc với thái độ phục vụ của nhân viên quán bún cá Ngọc Liên nên phải viết review này, chủ yếu là cho quản lý của quán. 
Chính xác là tối thứ 5, ngày 1/6, mình và mẹ đến ăn thử quán NL theo như bạn giới thiệu. Lúc mẹ mình hỏi món để order thì nhân viên phục vụ (bạn nữ mặc áo pull xanh lá) tỏ thái độ cáu kỉnh và cực kỳ vô lễ với mẹ mình. Dù rằng quán có đông khách hay mệt mỏi thế nào nhưng thái độ vô lễ với khách hàng, đặc biệt là người lớn là không thể chấp nhận được.
Mẹ mình bảo thôi ráng ăn đi con nhưng nói thật mình nuốt không nổi tô bún mang ra 1 chút nào, không ngon đã đành mà gặp chuyện như vậy càng không muốn nuốt. 
Đề nghị quản lý quán xem xét lại thái độ phục vụ của nhân viên.",0
146,"Ghé đây ăn trưa , quán cũng khá vắng - Phục vụ nhanh nhẹn - Thức ăn lên nhanh - Gọi 1 tô bún thập cẩm gồm sứa, chả cá , chả , cá , riêu - Thấy cũng khá ngon - Có điều sao thấy lẫn xoài xắt lát và đậu phộng nên có cảm giác như đang bị ăn gỏi sứa thừa bỏ đại vô tô - Tự nhiên thấy mất ngon",3
147,"Lại 1 điểm mới mà k mới; lâu lắm rồi mới đi lại quán này lần nữa. Mình ăn bún cá sứa, thích nhất sứa còn những cái khác cũng bình thường; quán quá đông nên hơi bẩn. Vị trí ngay khu trung tâm dễ tìm.",2
148,"Bún không ngon như dân tình review , mình ăn thấy khá mặn , chả cá với riêu cua thì khá ok , nhưng nước lèo không được ngon cho lắm , mình đi buổi chiều tối , quán khá vắng thấy toàn khách du lịch vào ăn ko à . Lần sau phải ghé thử quán khác mới được.",3
149,"Gần ngay trung tâm quảng trường quy nhơn. Quán rộng đẹp dễ tìm và ngon rẻ. Phục vụ cực kỳ dễ thương. Có nhiều loại từ 25k 30k đến 50k tùy loại. Quán khá đông nên các bạn nên đi sớm nhé. Gần đó có công viên thiếu nhi và quảng trường đi bộ trung tâm. Ăn sáng xong dạo phố ngắm biển là khỏi chê nhé. 
Nói thêm về món bún, nước dùng vừa ăn kèm nhiều loại rau thơm. Chả cá thì khỏi nói, tươi thơm và vừa ăn. Đến Quy Nhơn thì các bạn nên ghé thử đây nhé.",4
150,"Quán khá nổi tiếng. Lúc nào cũng đông. 
- Không gian: rộng rãi, nằm ngay trên đường Nguyễn Huệ nên dễ tìm
- Phục vụ: nhanh nhẹn
- chất lượng: khá ngon, chả cá đậm đà tuy nhiên hơi nhiều tiêu vì mình ăn cay kém, 
- giá cả: tô bé 30k, tô to 35-40k, mình gọi thêm 1 đĩa chả cá 20k nữa. Nói chung là đc
Ở đây có bán luôn cả đặc sản Bình Định ví dụ bánh kẹo hay chả, tré, ... Mua ở đây cũng khá rẻ. 
Nếu có cơ hội sẽ quay lại lần nữa.",4
151,"Bún chả cá, bún sứa... là đặc sản ở Quy Nhơn, rất hợp để ăn sáng nhé. Sau khi đã thử Phượng Tèo thì Ngọc Liên là địa chỉ tiếp theo. Cũng ở cùng phố với Phượng Tèo luôn
- Cửa hàng to, rất dễ tìm, quán rộng, thoáng mát và sạch sẽ nữa, Ngồi đến đâu bật quạt đến đó. Order là có ngay à lê hấp
- Mình gọi bún cả cá đặc biệt, có chả cá các loại, riêu nữa. Không phải riêu như bún riêu Hà Nội đâu, ở đây riêu rất hay, ngọt và thơm thơm, không có vị tanh. Chả cá các loại luôn, miếng to oành, bao nhiêu nữa, ăn mãi không hết. Nước dùng ở đâu ngon hơn Phượng Tèo, nước ngọt thịt chứ không phải chỉ ngọt đường, tất nhiên có cả vị ngọt đường vì đặc trưng ở đây ăn ngọt mà. Tuy nhiên mình ăn ngọt đc nên không là gì hết. 
- Một điểm nữa là quán mở cả ngày thì phải, nên ăn sáng ăn trưa ăn tối đc, chứ hàng quán ở Quy Nhơn mở theo múi giờ đặc biệt lắm :(( chậm chân là hết hoặc vào giờ lửng lơ toàn bị nhỡ thôi. Đi du lịch thì nên đến đây ăn vừa sạch sẽ ở trung tâm mà cũng ngon nữa",4
152,"Có dịp ra Quy Nhơn chơi được bạn chỉ quán này, nằm ở vị trí khá dễ tìm nên tấp vô 2 lần, bún chả cá 25k/tô, bún sứa 35k/tô. Ăn cũng khá ngon, quán đông nhưng phục vụ cũng nhanh lắm. Phần bún chả cá thì cá dai lắm, nhai mỏi miệng luôn, bún sứa có sứa nhiều, thích ăn chả cá nữa nên gọi tô sứa với chả cá luôn. Có hành tím chua ngọt bỏ vào ăn chung ngon lắm, vị giống giống bún chả cá của đà nẵng nhưng theo mình thì không ngon như ở đà nẵng :)",4
153,"Quán khá lớn và dễ tìm, nằm trên đường Nguyễn Huệ, đi qua cũng khá bắt mắt. Thực đơn của quán khá phong phú từ bún đến bánh canh, đến các loại nước giải khát, nhân viên đông đúc, nhanh nhẹn. Mình gọi 1 bánh canh chả cá và 1 bún chả cá cùng 2 quả dừa hết 105k, tô bánh canh nhiều hơn tô bún. Quán nổi tiếng nhưng mình ăn không cảm thấy có gì đặc biệt cả, không xuất sắc, không dở, nước hơi ngọt, chả cá ngon, không lưu lại gì trong tâm trí nên cũng không biết review gì. Nếu sau này có cơ hội quay lại thì mình cũng không ghé đâu :)))",4
154,"Đường nguyễn huệ hội tụ toàn những quán ăn nổi tiếng ở Quy nhơn. Ngoài phượng tèo ra thì ngọc liên cũng nức tiếng không kém. Menu gồm có bún chả cá, bún riêu, bún sứa, bún cá dầm, bánh canh và cuốn chả cá. Nguyên liệu để làm chả cá là thịt các loại cá mối, cá chai, cá thác lác... xay nhuyễn rồi vo thành viên hoặc làm bánh tròn lớn dày, phủ lên lớp trứng mỏng hấp chín cắt lát cho bắt mắt. Nước lèo được nấu từ xương, đầu cá , thêm vào một ít nấm rơm, măng khô. Ăn xong làm thêm ly nước đậu nành nữa là no tới trưa.",4
155,"Bún chả cá Ngọc Liên khá nổi tiếng ở Qui Nhơn . Quán to , rộng rãi và rất sạch sẽ . Nhân viên đông , tốc độ phục vụ món ăn nhanh . Ngoài bún chả cá ra quán còn có bún sứa , chả cuốn ... Giá cả tầm 15k trở lên . Tô bún cỡ 25k trở lên . Rau sống đi kèm được rửa rất sạch sẽ . Chất lượng món ăn ngon khỏi bàn cãi gì luôn . Đên QN mà không đến đây ăn thì tiếc lắm ❤️❤️ sẽ đến ăn dài dài 👍👍",3
156,"Quán bún cá rất ngon, đa dạng món, có thể mua các đặc sản Quy Nhơn ở đây! gần quán có phố ăn vặt rất nhiều món địa phương như nem nướng, mực rim, cá nướng, bánh xèo, bánh khọt....",4
157,"Quán nằm ngay trên đường Nguyễn Huệ, gần trung tâm nên khá dễ tìm, với quán to đùng mà. Quán rộng rãi,thoáng mát lắm. Cô chủ quán thân thiện,dễ gần,nhân viên cũng tận tình.Ít hôm trước có đến dùng bún cá rồi nhưng hôm nay ngon nên ghé lại ăn nữa. Vì ban bè mình hay ăn ở đây nên gửi hình cho mình review luôn cho đầy đủ các loại bún cá. Giá tầm 25k-35k. Có nhiều loại bún,tha hồ lựa chọn,đảm bảo bao ngon,bao no luôn. Nào là bún cá dằm, bún riêu,bún sứa có cả bánh canh nữa. Nếu là du khách thì nhớ ghé quán nha !",4
158,"Nếu bạn là du khách ghé thăm Quy Nhơn, thì tại sao ngần ngại mà không nhích mông vào quán thử xem tô bún như thế nào nhỉ, sẽ không hối tiếc tí nào đâu. Hãy tin mình !!!
Mình chưa thấy quán nào làm chả cá ngon như ở đây. Chả cá làm từ cá gì thì mình quên rồi. Nước đậm đà. Giá cả có hơi cao nhưng mình nghĩ giá tỉ lệ thuận với tô bún nên không sao đâu. Mình thường nhờ chị mua về nên không biết nhân viên quán phục vụ thế nào nữa.
Không gian quán rộng rãi,sạch sẽ,thoáng mát.",4
159,"Bún cá 25k/ bát, bún sứa 35k/ bát, sữa đậu nành 7k/ cốc, so với giá cả xung quanh quy nhơn là quá hơp lí (vì thấy ăn đâu cũng đắt). Giấy ướt trà đá miễn phí nhé (trong khi đa phần các quán đều thu tiền). Quán sạch sẽ, nhân viên nhanh nhẹn và thân thiện. Rất có cảm tình với quán này luôn ý. Quán ở ngay trên đường Nguyễn Huệ nên ai ở khách sạn Quy Nhơn, Mường Thanh đi ra đó khá tiện. Trong quán có bán 1 số đặc sản bình định nữa nếu có nhu cầu mua.",4
160,"Mỗi lần xuống Quy Nhơn thì hay ghé quán này. Khá nổi tiếng tại Quy Nhơn.
Vô đây hay gọi bún sứa, tại hồi giờ thấy có mỗi chỗ này bán bún sứa.
Giá cả khá vừa túi tiền đi kèm chất lượng.
Không gian thoáng, còn có cả lầu nữa.
Nhân viên thì phục vụ bình thường.
Bún sứa ở đây sứa dai ngon, nước dùng ngon. Tổng thể ngon.
Còn có các món như bánh cuốn, bún cá, bún chả cá, ...
Vì khá nổi tiếng nên người nước ngoài đến du lịch hay ghé đây.
Ăn 2 người tô khá to mà có 60/ 2 người",4
161,"Mọi thứ đều ngon
Cửa hàng khá đông nhất là vào buổi sáng
Nhân viên nói hơi nặng tiếng, có lẽ do mình người hà nội. Cực kì nhiệt tình, vẫn nói cho đến khi mình hiểu thì thôi
Phục vụ nhanh",4
162,"Quán này có tiếng lâu rồi, mở cửa cả ngày. Không gian rộng và sạch sẽ lắm. Khách đông, khách du lịch cũng nhiều. Menu đa dạng, có bún chả cá, bún sứa, bún riêu cua, bún cá thu... Tô nhỏ 25k, tô lớn 35k, cá nhân mình thấy ngon hơn ở Phượng Tèo nhiều. Tô bún đầy đặn, màu sắc hấp dẫn. Sợi bún dai, nước lèo thanh ngọt, riêu cua beo béo, chả cá đậm vị. Free trà đá khăn lạnh, có chuối ăn kèm thì tính thêm tiền. Nhân viên nhanh nhẹn, nhiệt tình lắm",4
163,"Chú taxi chở qua đây giới thiệu đây là quán bún cá nổi nhất Quy Nhơn, bảo sao mà quán to, rộng, khang trang và đắt vậy. So với thành phố ăn gì cũng tầm 10, 15k này thì bát bún riêu đặc biệt giá 35k kia được xếp vô hàng đắt rồi. 
Nhưng ăn thấy ngon phết mà. Nước dùng là nước riêu cua, ngọt, đậm đà. Cá là cá xay nhuyễn chứ không phải cá miếng như mình nghĩ, ăn lạ lạ hay hay phết. Có cái chả cá thì bị ngọt quá, không ưng. 
Trà đá khăn lạnh free nha, phục vụ trong này toàn free trà đá, thích. 
Phục vụ nhanh cực, quay đầu 2 cái đã thấy đồ ăn trước mặt rồi",3
164,"Quán này nổi tiếng Quy Nhơn dường như ai cũng biết, bún chả cá ngon, tô to bự, chất lượng. Cá tươi, dai, nước dùng thanh ngọt",4
165,"Sau 5 năm quay lại quy nhơn, cẩn thận hỏi vài người địa phương, họ đều giới thiệu đến quán này
Bún ngon, cá tươi, sứa tươi. Tóm lại thực phảm ngon. Nước bún rất vừa miệng. Rau và gia vị sạch sẽ, chất lượng. 
Giả cả hợp lý
Mong muốn Cửa hàng sẽ có cơ sở tại hà nôik",5
166,"Đc chú taxi chở qua quán này, giới thiệu là nổi tiếng nhất Quy Nhơn. Vào đọc review của các bác mà hoang mang quá :))
Thực ra cá nhân thấy ăn cũng được chứ k dở. Mình gọi bún sứa, có miếng sứa ăn giòn sật sật man mát cũng vui. Chả cá thấy bở bở ngọt ngọt k hợp khẩu vị lắm. 
Tổng thể thì cũng oke. Rau sống sạch sẽ.
Thích nhất văn hóa trong này là đc free trà đá nè :D
Khăn lạnh miễn phí nữa
Giá k rẻ :D cũng 35k/tô chứ k đùa :)
Quán to, rộng rãi sạch sẽ",4
167,"Quán bún dở nhất Quynhon. Ko đúng bài bún cá truyền thống. Nếu gọi là ngon thì quán đối diện cách 100 m phía quảng trường. Dân Quynhown ít ai ăn bún Ngọc Liên
Nhưng bù lại món cuốn ở đây rất ngon",0
168,"Quán ăn khá ngon, mình đã ăn trưa nay với 2 người bạn. Mình là người Nha Trang, muốn ăn để so sánh buan cá ở đây với ở Nha Trang x
Thế nào, nhìn chung có vị riêng, khá ngon. Nhưng quán là quán lớn, có rất nhiều bàn, nên có c giác là quán hiện đại chứ k phải quán bún nhỏ nhỏ, hjhj, nhưng lhas ngon, co nước chấm đặc trưng",4
169,"Tô bún đây khá chất lượng, ăn no bá cháy bò chét. Nhưng chưa thật sự gọi là ngon, ăn ok thôi. So với mặt bằng ở BD thì giá hơi cao 25k là ít nhất",3
170,"Quán bún cá nhưng mình lại zô đây ăn bún sứa, công nhận rất ngon và đậm đà :D",4
171,"Sơn hào hải vị tại Hướng Dương ngon quá xá ngon, có nhiều loại rau ăn kèm theo sở thích của toi và sứa nữa. Món ăn tại nhà hàng khiến tôi khó quên, sạch sẽ. View trang trí đẹp, đồ hải sản tươi, chế biến rất ngon",5
172,"Theo khẩu vị nhà mình đánh giá thì nhà hàng Hướng Dương khá ngon nhá. Nhìn mà thèm á, hải sản tươi ngon, nhà mình hay ghé đây để ăn cuối tuần",5
173,"Ghé đây vài lần, hải sản ở nhà hàng Hướng Dương rất tươi ngon, quán khá lớn nằm ngay eo gió nên rất dễ tìm.Mình khá bật ngờ vì trang trí khá ấn tượng và lịch sự. Bày biện cũng trang trọng và hấp dẫn.Quán để nhạc nhẹ nhàng, khách ra vào đông nhất là vào buổi tối Không gian trầm và nhẹ nhàng. Phục vụ nhiệt tình, nhanh nhẹn",5
174,"Tôm hùm tươi ngon, đồ ăn vừa vị, nhiều hải sản. Đồ ăn khá ổn và đều tay, mình ăn ở đây vài lần và lần nào cũng hài long, ngon nhất là lẩu hải sản. Giá cả ổn và cũng hợp lý so với chất lượng và so sánh với các quán ăn khác. Phục vụ thân thiện và nhiệt tình.",5
175,"Mình đã ăn hải sản ở nhiều nơi nhưng ưng ở đây nhất. Chỗ ngồi thì rộng rãi, mình thích ngồi gần biển để ngắm biển cho vui. Thái độ nhân viên niềm nở, dễ chịu, nhiệt tình. Vị trí trung tâm nhưng vẫn có chỗ đậu xe oto. Nhà hàng nhiệt tình đưa đón phục vụ. Triệu like",5
176,"Không gian đẹp, mát mẻ. Quản lý lẫn nhân viên đều ok nhiệt tình . Sạch sẽ từ bàn ghế chén bát cho đến từng cọng rau, hải sản ngon. Đồ ăn ngon, giá bình dân hợp túi tiền của nhà tớ nè",5
177,"Thích nhà hàng vì có vị trí thuận lợi vì nhìn được ra eo gió, rất ưng nơi này. Tụi mình đi 3 đứa con gái ord 2 phần ăn xong cũng khá no nha, ăn cũng ngon, xào khá thấm gia vị, hải sản khá nhiều và tươi, riêng cơm cá rất ngon luôn nha, tôm ăn mềm, ngọt thịt không bị bã, lần tới sẽ gọi lại món cơm",5
178,"Đã ăn ở đây nhiều lần và chưa lần nào thất vọng về nó Không gian quán rất thoáng, sang trọng, cách trang trí thể hiện rõ phong cách. Bữa mình tổ chức sinh nhật tại nhà hàng Hướng Dương, đúng là nơi lý tưởng để tổ chức nha. Các món ăn thì khỏi phải chê, đa dạng, trình bày cũng hấp dẫn người nhìn, đặc biệt là các món hải sản, cơm cũng ngon. Còn về các bạn nhân viên phục vụ cũng rất nhiệt tình, dễ thương, luôn chào đón khách, mỉm cười vui vẻ, không bực bội khó chịu khi đông khách, Cách bố trí nhân viên phục vụ cũng rất ổn. Gía cả thì không quá mắc cho một món ăn chất lượng, nước uống cũng không quá mắc.",5
179,"Đói đói mà thèm món tôm hùm là ghé đây liền không đó. Các món mình ăn đều rất vừa miệng, ngon, đặc trưng của biển hải sản, món tôm hùm rất rất ngon. Ngồi ăn ở đây không gian mát mẻ, nhân viên cũng thân thiện.",5
180,"Quán đẹp, hải sản ở đây khá ngon , đúng vị biển, tôm mực tươi ăn rất ngon luôn, giá cả lại quá hợp lí so với các nhà hàng hải sản trên thành phố, Nhân viên phục vụ rất nhanh nhẹn, dễ thương, thân thiện, phục vụ khá nhanh , món ra nhanh khi đông khách hay vắng khách đều vậy luôn, nhân viên rất lịch sự. Cửa hàng đẹp sáng sủa, trang trí hiện đại , đến rồi muốn đến hoài hoài. Chất lượng món ăn thì quá đạt chuẩn luôn. Nhất định sẽ đến lại nữa , ngon quá mà",5
181,"Hôm nay mình đi buổi trưa thì quán khá đông. Món tôm sú sốt me, cháo bào ngư của nhà hàng Hướng Dương là nhất, ở đây bán rất ngon. Chấm với nước chấm cực kì ghiền luôn. Nếu quay lại mình vẫn gọi món này. Trước giờ mình chưa ăn chỗ nào mà cho nhiều đồ ăn như vậy. Nhân viên rất dễ thương, mình nhờ lấy gì cũng rất nhanh và nhiệt tình. Giá cả phải chăng.",5
182,"Thích nhất 2 món này tôm hùm bông hấp nguyên con với ốc***nàng nướng mỡ hành. Nhân viên phục vụ nhiệt tình, nhanh nhẹn",5
183,"Có thể nói là khá hợp khẩu vị gia đình mình, ăn nhiều nơi nhưng đây là lần review vì hải sản ở đây quá tươi ngon, vị ngọt của hải sản làm nên hương vị tuyệt vời",5
184,"Mình đã ăn hầu hết các loại hải sản ở đây, vì mình là đứa nghiện hải sản. Giá cả của các quán cũng sàn sàn nhau nhưng hải sản này ngon thật sự, tươi. Mình đi 5 người ăn quá trời no căng bụng. Nước chấm rất ngon. Món ăn đa dạng nhiều món",5
185,"Nhân viên tận tình, rất hài lòng với thái độ phục vụ ở đây, đồ ăn thì khỏi chê. Nhà hàng Hướng Dương tên đẹp mà đồ ăn ngon, nhân viên dễ thương",5
186,"Quản lí và nhân viên nhiệt tình đưa đón phục vụ. Ăn hoài không ngán, vì mê món ăn ở đây mất rồi.",5
187,"Nước lèo thanh ngọt đậm vị của nhà hàng Hướng Dương ngon, cảnh quang nhà hàng trang trí đẹp, đồ hải sản tươi, chế biến rất ngon",5
188,"Món ăn tại nhà hàng khiến tôi khó quên, món ăn ngon sạch sẽ, món sứa tươi giòn sừn sựt chan với nước lèo chua ngọt ngon lắm luôn",5
189,"Sơn hào hải vị tại Hướng Dương ngon quá xá ngon. Rau ăn kèm khá nhiều và sứa khá béo ngậy, ngon, sạch sẽ",5
190,Như khẩu vị nhà mình đánh giá thì nhà hàng Hướng Dương khá ngon nha. Menu phong phú nhiều món ngon dễ lựa chọn,5
191,"Mình hay ghé quán ăn, hương vị và độ tươi ngon vẫn như ngày nào. Hôm nào lại ghé ăn nữa, thơm ngon nhắc lại thèm quá hix",5
192,"Mùi của hương vị làm kích thích thơm ngon khỏi bàn luon ý. Món tôm sú sốt me, cháo bào ngư của nhà hàng Hướng Dương là nhất",5
193,"Nhà hàng Hướng Dương nơi lý tưởng để tổ chức sinh nhật, không gian rất đẹp và thoáng mát",5
194,"Nhà hàng Hướng Dương nhiệt tình, sạch sẽ, món ăn tuyệt vời hi",5
195,Các bạn nhân viên phục vụ rất tận tình và chu đáo. Yêu lắm,5
196,Mình sẽ quay lại thường xuyên cùng gia đình và giới thiệu cho bạn bè nhé,5
197,"Nhóm tớ thích nhất món tôm hùm bông hấp nguyên con, ăn hợp khẩu vị, thơm ngon",5
198,"Gia vị giữ nguyên được độ tươi ngọt của Hải sản, ăn vô rất thích",5
199,"Nhà hàng Hướng Dương đồ ăn ngon, sạch sẽ rât ưng ý",5
200,"Nhân viên nhà hàng Hướng Dương tận tình, khá hài lòng với thái độ phục vụ",5
201,"Bữa tối thứ 2 ở Quy Nhơn, chọn quàn này nhưng tương đôus thất vọng.
Ưu: 
- Thân thiện
- Sò dương nướng tươi ngon
Nhược
- Rong nho ăn cực chán
- Các món ăn còn lại bình thường 
- Nhà vệ sinh cực bẩn

Nói chung cảm thấy không muốn giới thiệu cho người khác",3
202,Đây là bữa tối mà gđ mình đến quán hướng dương vẫn như buổi sáng mà mình gth cho các bạn .. những bạn nào lần đầu đến đây ăn có thể tham khảo các món mà gđ mình gọi nha ❤️ đồ ăn rất ngon không gian buổi tối se se lạnh nv rất ân cần với khách ...mình sẽ còn ăn ở đây vài hôm nữa,5
203,"Quán đồ ăn ngon giá cả hợp lý nhân viên nhiệt tình có xe đưa đón miễn phí, có dịch vụ kỳ co",5
204,"Đây là những món mà gđ mình đến quán ăn. Món ăn ở đây rất ngon và hợp giá tiền,đồ ăn trang trí bắt mắt,các bạn đến đây hãy ăn thử món rong nho salad và lẫu sứa nước lèo nhé vì nó rất ngon 🥰🥰 không gian thoáng mát sach sẽ có xe đưa đón free tại FLC và nv phục vụ nhiệt tình dễ thương.Có dịp sẽ quay lại quán nhé ❤️❤️❤️",5
205,"Nhà hàng đồ ăn ngon sạch sẻ họp vệ sinh hải sản tươi sống nhân viên nhiệt tình dể thương ❤❤❤
Giá cả họp lý 😍😍😍😍",5
206,"Quán đồ ăn ngon giá cả hợp lý nhân viên nhiệt tình có xe đưa đón miễn phí, có dịch vụ kỳ co",5
207,"Thực đơn phong phú đa dạng 😘😘
😍😍😍😍 5********* 😍",5
208,"Mình không ăn được ốc nên chụp vậy thôi nhưng nghe bạn mình bảo là ngon mà rẻ, còn gà ở đây muốn ăn phải đặt trước 1 tiếng để nhà hàng chuẩn bị từ khâu vặt lông gà tới chế biến, gà nhà nuôi nên dai và ngon cực kì. Quán gần FLC nên có xe đưa đón ra vào rất tiện ạ♥️",5
