 ,Review,an_uong
258,"- Quán cà phê hay ho để chụp ảnh. Buổi tối tấp nập chứ ban ngày khá nắng nên hầu như chẳng có khách
- Đồ uống bình thường, không quá chán những không có gì đặc biệt, nhưng vị trí đẹp và decor đáng yêu nên là điểm hấp dẫn nên đến.
- Quán có bàn ghễ gỗ và có ghế tựa dài để nằm ngắm biển, có cả chỗ tắm tráng cho ai đi tắm biển lên thay đồ",3
259,"Tối qua mình với người yêu coi Đấu Võ Đài xong thì qua đây cafe. Quán này là điểm chụp ảnh cưới nổi tiếng ở Quy Nhơn luôn. Sáng hay tối gì cũng đẹp lung linh y trên hình, nói chung là mình đến đây rất thích. 
Không gian và nhân viên thì ổn nhưng thức uống dở tệ luôn. 2 ly yaought trái cây với sinh tố bơ tuy không mắc, chỉ 80k nhưng chất lượng quá kém, nước nhạt nhẽo, trái cây lèo tèo. Quán có thể bán đắt hơn tí mà thức uống ngon thì tốt hơn nhiều. Thực tế thì SG là đắt đỏ nhất mà bán 35k/ly còn ngon hơn mấy lần. 
Nếu cải thiện thức uống thì quán là số dzách luôn nha!",4
260,"Đến Quy Nhơn chơi đc bạn dẫn ra qán cf này. Vì qán sát biển nên không gian thoáng mát, buổi tối lên đèn lung linh, view đẹp, lãng mạn. Đồ uống có giá hơn cao nhưng chất lượng. Có cái là nviên order chậm, tụi mình vô khoảng 10' rồi mà k thấy nviên đâu, phải vô tận qầy bar ns rồi ms có nviên ra. Cơ bản là vẫn chấp nhận đc.",3
261,"Trưa mình dẫn khách đi ăn hải sản trên đường ngọc hân công chúa, xong người ta đòi đi uống cafe. Nhớ ngay trên đường xuân diệu có surf bar nên cả đoàn rồng rắn đi bộ. Surf bar 2 cũng không khác surf bar 1 là mấy, cũng cùng kiểu trang trí với nội thất. Menu không có quá nhiều món, được y một trang giấy, giá cả mình thấy hợp lí, không quá mắc. Bởi vì view ở đây nhìn cực đẹp, ban ngày biển xanh nắng vàng. Nước uống không quá xuất sắc, đề xuất mấy bạn nên gọi nước ép trái cây và sữa chua.",4
262,"Đây là 1 điểm rất nổi bật ở thành phố Qui Nhơn. Quán cafe nằm trên bãi biễn, vừa uống vừa ngắm cảnh rất tuyệt vời. Ở đây có phòng thay đồ nếu bạn muốn xuống bơi ^^ Buổi tối ở đây rất lãng mạn, bật đèn vàng nhìn rất lãng mạn. Tuy quán rất đẹp nhưng giá nước siêu mềm, chỉ dao động 20k - 30k. Nếu ai đi du lịch ở Qui Nhơn nên đến đây trải nghiệm ^^",4
263,"Ở Qui Nhơn thì có mỗi quán này là mở ngay tại bãi biển thôi . Có 2 chi nhánh , cách nhau cũng không xa lắm .
Quán nằm ở biển nên rất mát mẻ . Buổi tối lên đèn lung linh . Mặc dù hơi tối một tí .
Mấy mùa hè nóng nực thế này mà ra đây ngồi uống nước hóng gió biển thì mát cực .
Ở đây thu hút rất nhiều khách du lịch .
Menu cũng có nhiều món ăn vặt đi kèm với nước .
Giá cả hơi cao một tí so với mặt bằng thành phố",4
264,"Đồ uống ok, view đẹp vchg ra í, mình vào Quy Nhơn 4 ngày mà ra đây ngồi 3 buổi tối liền 😂😂",5
265,"Vừa vào Quy Nhơn xong, search thấy có quán này hay ho nên vào thử.
View khá đẹp, ngay bờ biển, decor cũng lung linh, như kiểu tiệc cưới ngoài bãi biển vậy.
Đồ uống cũng không quá đắt, tầm 35-55k, nhưng không ngon lắm.
Mình gọi mojito và sữa chua đặt biệt. Mojito uống như nước chanh có thêm lá bạc hà, sữa chua có mấy miếng dưa hấu xắt nhỏ và 2 lát chuối! :(
Với lại quán ở ngay bãi biển nên nhiều cát, em nhân viên đi qua là cứ như bung cát lên vậy, phải cầm ngay ly nước lên vì sợ bụi! ))",3
266,"Không gian bên bờ biển rất thoải mái, nhạc hay, giá hợp lý. Cocktail 55k, beer 30k, mấy món nhâm nhi như xúc xích, mực...Mỗi tội gặp trẻ em nhiều quá, chạy nhảy đùa giỡn như công viên vậy. Chắc cũng sắp giống Sailing ngoài Nha Trang. Cocktail pha ổn mà decor như ly nước trái cây vậy.",4
267,"Đi qua Surf Bar 1 không thấy ấn tượng mấy, thế mà đi qua Surf Bar 2 thì lung linh mê luôn. Lúc đi qua nhjac bật cũng hay nữa nên nhất quyết vào luôn, ai ngờ lúc sau nhân viên bật nhạc căng cực và nói là do khách khác yêu cầu. Mình muốn đổi nhạc thì cũng mãi mới đổi được bởi nhân viên cũng không biết gì và hay đùn đẩy. Nhân viên bên này nhiều nữ và độ tuổi trung bình có vẻ cao hơn bên số 1, thái độ cũng không nhiệt tình bằng.
Nhưng pha đồ ngon hơn. Pina Colada bên này pha ngon, đựng trong trái dừa decor thêm ít dứa nhìn cưng dễ sợ. Giá thì như bên kia, khá rẻ so với không gian và chất lượng.",4
268,"Đi bộ tìm quán bánh mì, xong nhìn thấy chỗ này, mấy đứa mê quá phải ghé vào. 
Không gian quá đẹp ý. Kiểu buổi tối, bên bờ biển, ánh sáng lung linh, khung cảnh lãng mạn luôn. Tối dắt nhao ra đây tâm sự thì cũng ấm lòng. Cơ mà ngồi 1 lúc, gió biển thổi lên thì cũng muốn run người
Đồ uông thì cũng được, mấy loại mocktail decor dễ thương. 
Nhân viên thì hên xui, có ng nice, có ng k. Guu nhạc cũng hên xui :))))
Giá ổn, so vs vị trí, không gian thì cũng k đắt :)))",4
269,"Mình đi du lịch, buổi tối dạo biển vô tình thấy quán này. Rất thích.
Quán này nằm ngay bờ biển, ngồi trên cát có thể thường thức nước uống và ngắm biển buổi tối, nghe tiếng sóng rì rào. Trang trí đẹp, có đèn lung linh.
Thức uống đa dạng, có coffee, cocktail. Giá cũng hợp lý, không mắc.
Có thể gửi xe ở vỉa hè đối diện.",4
270,"Không gian thoáng, mìn đặc biệt yêu thích những chiếc đèn nến, nệm trải nằm duố cát, nằm xuống ngắm sao trời hoặc ngồi nhìn ra biển vu vơ. Không gian lãng mạn thích hợp với người đam mê không gian rộng như mình.
Nước uống bình thường",4
271,"Nằm ngay đối diện khách sạn mình ở. Nước k có gì đặc sắc. Giá cả ở quy nhơn được coi là đắt nhưng so với hà nội là bình thường. Bù lại là quán có view rất đẹp nhìn thẳng ra mặt biển nhưng điểm trừ là trời mưa là bàn ghế ướt hết hết ngồi rất khó chịu. Buổi tối đẹp hơn, có nhạc sống nên đông hơn buổi sáng",3
272,"Chỗ này gần nhà mình ở quê, chiều nào cũng ra biển chơi, nước không có gì đặc biệt nhưng view rất đẹp, buổi tối thì siêu lãng mạn đấy :) view để mọi người tham khảo nhé :)",4
273,"Không gian đẹp.
Decor cũng đẹp.
Đồ uống tạm được.
Nhân viên phục vụ cực dễ thương.",4
274,"Quán cafe chỉ nên đi buổi tối mới đẹp, còn buổi sáng thì hơi nắng . mình đi cùng chị , gọi mojito và trái dừa uống . Có mojito là mình thấy ko ngon cho lắm, cách pha cũng ko ổn, đá quá nhiều, giá hơi cao so với chất lượng. quán nên xem lại công thức pha chế ^^",3
275,"Ở Quy Nhơn nhưng lâu lâu mới về thăm nha, lần nào về cũng ghé chỗ này, quán mới mở chưa tới 1 năm mà làm thay đổi cả khu này, nhìn biển đẹp hơn, sạch và trong hơn, chụp hình biển là đẹp thôi rồi, ngồi uống nước ban ngày là chụp hình đã luôn, buổi tối ngồi mát lạnh, nước uống rẻ không mắc, thoáng mát, thoải mái, nhiều gốc để ngồi đẹp nhất, chỗ này chụp hình cưới là quá hợp luôn đó, ai về Quy Nhơn thì ghé biển Xuân Diệu vào đây là thích lắm,
Nhân viên cũng ok, thân thiện, vui vẻ,",4
276,Có thể đặt hàng online k ạ? Có giao hàng k ạ,2
277,"Có ai ship được giúp mình bát ốc len nhà cô Xí ra Hà Nội khôngggg, huhu. Món này thực sự quá đỉnh. Mình ăn 1 lần mà thèm vật vã mãi, k tìm được quán nào ở HN có món ngon như vầy.
Giá cả thì siêu rẻ vô địch, phục vụ nhanh cực các bạn ạ!",4
278,"Mình đi 2 nguời ăn nghêu hấp sả, bạch tuộc, hàu, cháo ghẹ. Mình và bạn đều thấy ngon, hải sản tươi, giá rất rẻ nữa. Mình thích nhất món nghêu vị rất đậm đà nè. Nhân viên cực kỳ vui vẻ và dễ thương luôn. Có dịp mình sẽ quay lại thưởng thức tiếp!",5
279,"Mình coi review trên mạng và đến ăn thử. Vốn là dân ghiền ăn hải sản và từng ăn nhiều loại hải sản ngon nên khi tới quán này mình thấy hải sản k ngon lắm, đặc biệt món càng ghẹ rang muối k được tươi, bị ươn và có mùi. Nhưng đồ ăn thì cực nhiều và với giá thì cực rẻ, nên mình nghĩ là với giá như vậy thì chất lượng k thể đòi hỏi hơn được, và với mình thì mình sẽ k quay lại quán này, vì hải sản k được tươi ngon :)",3
280,"Nhiêu đây mà có 400k thôi đó, trời ơi tin được khônggg🤤
Thức ăn vừa ngon, vừa tươi lại càng cực kì rẻ nữa chứ, nhân viên ở đấy cực kỳ dễ thương luôn. Bọn mình chỉ ở 1 đêm tại trung tâm nên không được thưởng thức lần nữa, có dịp nhất định sẽ quay lại♥️",5
281,"Ốc không bị cát. Giá rẻ. Vừa gõ bình luận vừa thèm. Lúc mình đi tới sớm thì ngồi ăn vừa cảm giác thoáng đãng lại ngay lúc chưa quá đông khách nên chill lắm :)) Ghé lại Quy Nhơn, nhất định mình sẽ quay lại.",4
282,"Mình chơi ở QN 3days mà 2 tối ghé quán ăn ròi. Nêm nếm rất ngon, dĩa nào chất lượng dĩa đó nên ngày đầu có kêu quá hớp vì cứ nghĩ dĩa ốc nhỏ nhỏ xinh xinh giống ở SG. 2 người ăn thì kêu tầm 3-4 món thôi, ăn hết thì kêu típ nha mí bạn.
Recommend 1 số món mấy bạn nên thử nè:
- Ốc xào ăn chung vs bánh mì (mồi này hơi bị tốn bia :v)
- Xìa hấp xả, nc nêm rất ngon và thơm
- Ốc tỏi con to mà có 12k/em à
- Cháo ngon lắm nhé
- Hàu nướng mỡ hành
Chỉ có món ốc móng tay là mình ko thik do sạn hơi nhìu nên bỏ nguyên dĩa. 2 người ăn tốn khoảng 200k là no ròi :v
Phục vụ siu dễ thương và nhiệt tình ^^",5
283,"Đồ ăn làm ngon, đậm đà, ăn vừa miệng, nhiều màu sắc. Menu có nhiều món và cách làm phong phú. Thời gian chờ món nhanh tầm 15-20 phút. Giá cả chấp nhận được, trung bình mỗi món 50-60 nghìn. Vị trí dễ tìm. Chỗ ngồi thì rất bình dân.",3
284,"Đến ăn theo review trên này, quán mới chuyển qua cái hẻm ở đào duy từ thì phải k còn ở số 40 nữa.
Đồ ăn: ngon
Phục vụ: nhiệt tình, anh chủ nói chuyện rất thân thiện 
Giá cả: rẻ, rõ ràng, ở quán có menu giá đầy đủ nhé không như mn review trên này là k có giá
Sẽ còn quay lại",5
285,"Seach map để đến quán. Hỏi sô 40 Đào Duy Từ mà hông ai biết. Dân địa phương còn nói đường gì tên lạ quá 😂
Tưởng mị bị troll r nhưng may cố gắng đi đại. Quán khuất trong hẻm nhỏ, đường vắng. Không để í sẽ đi hố đó. 
Ngó đc menu hết hồn lun. Đơn vị theo đĩa chứ không cân gì đâu. A chủ quán oder quan tâm mức độ hài lòng của khách lắm. Cứ ra hỏi thăm ăn được không, ngon không. Giới thiệu thêm giùm a nha. 
Tổng thiệc hại mớ đó + 1 đĩa nữa mà ngon miệng quá không kịp chụp ^^ và 2 pepsi 1 Tiger 390.000₫ 
Tuyệt vời lun ạ. Có dịp ra Quy Nhơn nữa sẽ ghé.",4
286,"Huhu,ốc tươi ngon mà lúc thanh toán thì siêu rẻ, 2 đứa ăn xong thanh toán tưởng tính nhầm :(( phục vụ nhanh nhẹn vui tươi, mải ăn ko chụp dc hết :((",4
287,"Mình ở Sài Gòn ghé thăm, thấy các bạn review ok nên cũng ghé thử. Nói chung món ăn ổn và ngon. So giá với số lượng vầ chất lượng thì ngoài này rẻ hơn rất nhiều. 
Các bạn ở xa nên tìm địa chỉ: 22 Đào Duy Từ dễ tìm hơn nhé",4
288,"Quán ốc vỉa hè cô xí nhưng đầy chất lượng , ăn ở đây đúng đáng đồng tiền , đồ ăn cực ngon, mới đi ăn nãy giờ nghĩ lại lại thèm , quán với đủ các loại ốc các loại , ghẹ cua , có cả cháo và trộn , giá cả lại phải chăng, không đắt lắm nên các bạn có dịp nên ghé ăn thử , không gian cũng khá sạch sẽ , ăn xong có nước rửa tay , cháo mọi bữa mình ăn thấy ngon lắm nhưng hôm nay thấy vị không được như ngày xưa mình ăn nữa, không biết là sao, nhưng dù sao đồ ăn ở đây vẫn rất ngon,",4
289,"Đây là một nơi rất nổi tiếng đối với team ghiền ăn ốc, quán nằm ở vị trí khá dễ tìm, với 2 không gian ngoài trời và trong nhà, quán sạch sẽ.
Menu đa dạng sò lông, ốc nhảy, sò huyết, ốc hương, ghẹ hấp... để bạn tha hồ chọn lựa. Mùi thơm nghi ngút. Nhất là cháo hải sản rất ngon nha. Ốc len xào dừa thì thơm ngon béo ngậy.
Không chỉ ngon mà còn giá cả phải chăng. 
Cô chủ quán dễ thương, nhiệt tình. Phục vụ rất nhanh nhưng tầm 17h-19h khá đông nên phải chờ.
Các bạn khi đến Quy Nhơn du lịch nên thử ghé quán thưởng thức nha.",4
290,"Qua đi du lịch tới Quy Nhơn đc bạn dẫn tới quan ốc cô xí ăn, quán nằm trong con hẻm nhỏ, khá bình dân, cô xí và các nhân viên rất nhiệt tình vui vẻ, các món được làm khá nhanh trong 1 phút là có tất cả nhé. Quả thật rất ngon, đặc biệt nhất càng cụm núm và cháo ghẹ, ốc trộn nữa. Ốc móng tay cũng ngon, ốc nào con nấy đều to ngon ko thể ta khác ở Đà Nẵng quê mình nhiều, ăn no cái bụng đã vậy giá cá khá rẻ, lần sau có dịp đi Quy Nhơn mình sẽ tiếp tục ăn ủng hộ. Chúc quán luôn đông khách 💋",4
291,"Ốc cô xí mình tìm được qua các bài review khi đến quy nhơn. Nước chấm và chế biến ngon, thấy các cmt bảo đồng giá từ 20_30k nhưng menu lại ko để giá. Và giá cũng không đến mức quá rẻ như lời đồn :D hoặc tại nghe giọng lạ biết khách du lịch nên có đội giá hơn 1 tẹo. So với những nơi khác thì giá như vậy cũng được cho là ổn. :D mình đi 2 người nhưng vì để dành cho 1 list dài các món ăn vặt khác nên chỉ gọi chừng đó.:)) tổng thiệt hại là 200k cho 4 món. :))",4
292,"Bữa nay đi tour ra Qui Nhơn chơi, tối tối rảnh mò đi kiếm ốc ăn nên lết bộ từ khách sạn qua quán Cô Xí, tuy hơi xa 1 xí nhưng rất nhon lun!!

Nhóm mình đi 3 người, gọi 1 ốc trộn lớn, 1 ốc mỡ xào nhỏ, 1 ốc len xào dừa nhỏ, 1 sò điệp nướng nhỏ tổng hết có 140k hoi mà no, trà đá lấy thoải mái nhé!

Phục vụ thân thiện lắm, nhất là cô Xí rất dễ thương lun. Quán trong hẻm và trong nhà, hơi nhỏ nhưng ok. 

Sẽ quay lại quán nữa vì cô Xí và vì món cháo ghẹ, tại thấy bàn nào cũng gọi hết nhưng no mất r ><",4
293,"Đồ ăn ở đây ngon và rất rẻ,tiếc là không có dịp để ăn nhiều món khác. Nếu vào lại Quy Nhơn sẽ ghé lại quán lần nữa.",3
294,"Quán vừa có chỗ ngồi trong nhà lẫn ngoài đường, men theo bờ tường trong hẻm. Ấn tượng đầu tiên là quán cũng sạch sẽ, gọn gàng, có bồn và xà bông cho khách rửa tay sau khi ăn xong.
 Mình order các món ""nổi tiếng"" do mọi người review để ăn thử: cháo ghẹ, ốc xào sả ớt, ốc len xào dừa, ốc quạt (sò điệp) nướng và 1 phần ghẹ (120k/nửa kg) và 1 lon 7 up. Tổng thiệt hại là 280k.
Cháo và ốc xào sả ớt ăn ngon và vừa miệng, có vị đặc trưng. Các món còn lại ăn cũng bình thường, ghẹ bị bở và nhỏ, ăn ko ngon lắm, gỡ gạc lại bằng nước chấm ngon. 
Nhìn chung thì cũng khá ổn cho các món ốc với giá bình dân như vậy. Nếu có dịp chắc có thể sẽ quay lại thử các món khác 😊",4
295,"Lần nào thèm ốc là nghĩ tới quán này đầu tiên . Ngon bổ rẻ nên quán khá hút khách . Tuy nằm ở vị trí không tập trung khu ăn uống nhưng quán vẫn được nhiều người biết đến . Quán có món cháo ốc rất ngon và rẻ , một tô như vậy chỉ có 20k thôi 2 người ăn là vừa . Ốc len xào dừa cực thơm , nước rất đậm vị , húp nước không cũng thấy ngon nữa :)) . Ngêu hấp thái cũng rất ngon , ngêu tươi và được làm rất sạch nên không còn cát nên ăn rất yên tâm .",4
296,"Đây là quán ốc mình thích nhất ở Quy Nhơn, mỗi khi thèm ốc thì sẽ đến đây ngay và luôn. Quán có 2 không gian trong nhà và bên ngoài nhưng sắp xếp gọn gàng và nhìn rất sạch sẽ. Menu cảu quán khá đa dạng, muốn ốc nào cũng có và thể loại chế biến nào cũng được luôn. Mình thích ăn nhất là ốc xào sả ớt , món này ăn với bánh tráng nước là y bài, ốc len xào dừa ở đây cũng rất ngon, nước siêu thơm và ngọt. Các bạn nên thử cháo ốc ở đây, 1 tô lớn chỉ có 20k thôi nhưng ăn chất lượng lắm. Thái độ phục vụ ở đây cũng rất thân thiện và nhiệt tình.",4
297,"Lần nào thèm ốc cũng ghé quán này.
Bị cuồng ốc xào xả ớt với ốc len xào dừa ý trời. Ngon quá thể đáng lúc nào tới cũng 2 món đó thêm một tô cháo, 2 lon nước ngọt rồi chiến thôi.
Đi 2 đứa nên kêu ít vậy đó ☺️☺️.
Bữa có thử càng cúm núm xào me cũng ngon lắm đó.
Ghé Quy Nhơn nhớ thử quán này nhen!!",4
298,Quán bán ăn rất vừa miệng nhưng mà ngon mà giá hơi cao so vs sinh viên nhưng mà rất ngon :)))),4
299,"Hôm nay tự dưng thèm ốc tháy trên foody có review về quán này nhiều nhưng chả rủ đc mem nào đi chung nên thôi xách xe chạy mình ên :)) quán nằm trong hẻm nhưng cuũng dễ tìn vì trc hẻm có để bảng hiệu của quán. Vì đi 1 mình nên chỉ kêu 1 ốc trộn vs 1 ốc len xào dừa. Dĩa ốc trộn cực ngon, thịt ốc dai dai mềm mềm lại khá gìon chủ 15k/ dĩa thôi. Vì khá đói nên mình đã ăn luôn mà quên chộp lại... hihi :) còn tô ốc len khá to giá 25k rất đậm vị nước cốt dừa ăn rất thích, chỉ tiêc là hôm nay mình có xui gì ko mà tô ốc của mình có đến 5-7 con rỗng ruột... thiẹt hụt hẫng mà 😥
Túm lại là quán ốc ngon, lần sau sẽ rủ đám bạn đi chung để ăn thêm đc nhiều món hơn 😁😁",4
300,"Fan của ốc và đặc biệt là những quán có gia vị đậm đà nên mình thích ốc lắm, thường có quán mới là phải đi liền.
Dc cái mình có thằng-bạn-thân tâm lý, dẫn qua đây ăn liền :)))
Ta nói, nó xa hen, nhưng mà hông sao, vì sự nghiệp ăn uống tất cả đều ok :))
Siêu phẩm: nghêu hấp: chưa quán nào làm qua quán này nhé, ngon cực kỳ, nước y như ăn lẩu luôn, thơm nức.
- Mực cơm sa tế cũng ok, kèm theo cháo ghẹ càng hấp dẫn ,đồ ăn ra nhanh. có điều ngồi ngay cái cống ko dc sạch sẽ lắm. giá bình dân",4
301,"Quán khá nhỏ lại nằm trong hẻm nên khi đông khách không có chỗ đợi.
Món yêu thích nhất của mình là ốc trộn và cháo hải sản.
Cháo hải sản vị rất vừa ăn nêm thêm chút muối quán đưa ra thì ngon ngọt hơn.
Ốc trộn làm từ ốc biển, rau răm, xoài, muối... thịt ốc dai dai cùng rau trộn ăn ngon lắm.
Giá ở đây khá ổn nhưng dịp tết vừa rồi ghé quán giá khá cao mà chất lượng lại không bằng trước :(
Hy vọng ghé quán lần tới sẽ không như vậy nữa.
Cô chủ quán thân thiện. Phục vụ nhanh nhẹn.",4
302,"Món ăn ngon, sạch sẽ, ốc đa dạng. Mỗi lần đi quy nhơn là chiều lại phải tranh thủ ghé vô ốc cô xí. Ăn ở đây cũng vài năm rồi vẫn ghiền, thấy càng ngày món càng ngon và đa dạng hơn. Mùa nào ghé ăn cũng đầy đủ ốc ngen, chỉ có thêm chứ chưa bao giờ thấy thiếu món. 
Thấy mỗi lần tới quán ốc của cô này lại mở rộng hơn, sạch sẽ hơn, menu đẹp hơn, khách vẫn đông nườm nượp và món vẫn ra rất nhanh . Món thì ngon khỏi nói, vị đậm đà không giống kiểu ngọt ngọt miền Nam, rất đặc trưng mặn ngọt miền trung, đi đâu thèm quá rồi cũng quay về quán cô.",4
303,"Thứ nhất, về vị trí và mặt bằng quán. Quán khá nhỏ, phải ăn ngay trên con hẻm. Lại không có chỗ dựng xe. Vả lại quán cực kì khó tìm cho những người ở xa đến như tớ 😭 đây là điểm trừ khá lớn đấy. 
Thứ hai, về phục vụ. Mình khá thích bà phục vụ ở đây. Tuy hơi chậm chạp nhưng khá nhiệt tình và chu đáo lại còn vui vẻ :3 Thức ăn được chuẩn bị và mang ra cho khách khá nhanh. 
Thứ ba, về món ăn. Ở đây bán khá nhiều loại ốc. Và chất lượng cũng khá ổn. Mình đã thử ốc len xào dừa, hàu nướng mỡ hành, gỏi ốc và nghêu..đều khá hài lòng. Đặc biệt thích hàu nướng và ốc len nhé. Ốc béo béo :3 thích cực kì. 
Cuối cùng, về giá cả. Hôm ấy khi tính tiền thì khá sôca vì giá. Rất rất rất mềm luôn ấy. Một đĩa ốc chỉ tầm 3-40k. Quá tuyệt vời.
Mình sẽ ghé quán nhiều hơn nữa ❤️",4
304,"Quán nằm trong 1 căn hẻm nhỏ nhưng không bao giờ quán ngưng đông người ăn... mỗi lần mình đến quán đều phải chờ đợi để có chỗ ngồi ăn mình thích... ở đây có rất nhiều món ăn ngon như là ốc trộn, ốc len xào dừa, ốc xào xả ớt, càng cúm núm và cháo hải sản... mỗi món ăn là 1 hương vị riêng biệt mà không quán ốc nào có được nhưng khi bạn đến đây bạn sẽ cảm nhận đc điều đó... mình rất thích cách mà cô chủ phục vụ khách hàng rất vui vẻ và tự nhiên nên ai cũng có cảm giác thoải mái khi tới quán...",4
305,"Quán ốc rất là phong phú, nhiều loại ốc, ghẹ, chiên xào nướng đủ kiểu. Ốc cô làm rất rất ngon, đậm đà, rất thấm, cay cay, mấy đứa đi ăn mà hít hà mút mút liếm liếm đã lắm. Giá cũng hơi chát nhưng mình nghĩ ở quy nhơn hải sản đều tươi sống, quán cũng nổi tiếng như v thì giá cao chút cũng không sao. Quán nằm trong hẻm, rất sạch sẽ, thoáng mát, tuy nhiên không hợp vs nhưngx ai đi theo nhóm đông người. Chừng 5,6 người trở xuống là vừa ấm cúng vừa đông vui luôn.",4
306,"Quán ốc quen thuộc. Thích vì đồ ăn nhìn sạch sẽ, chỗ ngồi không ruồi không muỗi.
Quán nằm trong hẻm nên để xe ở đối diện hẻm rồi vào ăn nha ☺️
Ốc trộn như món khai vị, lúc nào đến cũng gọi đầu tiên :))
Sò nướng mềm mềm, nước sò ngon lắm luôn. Giá 30k
Ốc xào xả ớt dai nhai mỏi cả miệng, vị mặn vừa ăn rất ngon, có ớt nhưng hổng cay cho lắm. Giá 40k
Tổng thiệt hại cho lần ăn vừa review là 98k. 2 người ăn 3 món cũng đủ no",4
307,"Mình ăn thử tôm càng luộc, ốc trộn, ốc len xào dừa, hàu nướng hành, nghêu luộc nữa.
Và mình đặc biệt thích món hàu nướng với lại ốc len :> Ốc len thơm, béo, giá chỉ 40k/tô :((((( Còn hàu thì thôi rồi.. núng na núng nính luôn ấy :3 vừa béo vừa ngọt.. mà chỉ 30k/đĩa. (Lúc tính tiền bất ngờ luôn ấy :> ) Mà k ưng ý với món tôm càng lắm.. kiểu bị hôi hôi ấy :(((( còn các món còn lại cũng khá ok.. giá cũng mềm nữa. 
Điểm trừ là quán khá khó tìm :((( mình đi xe ô tô mất 20p mới tìm ra quán đấy :((( 
Nói chung là sẽ ghé lại nhiều lần nữa :3 
  *Chụp lại mỗi món ốc len thôi*",4
308,"Sau 3 tháng, về Quy Nhơn mình vẫn quay trở lại quán. Nhưng tiếc là ko đc ăn món cháo ghẹ. Đặc sản của quán.
Nhóm mình đi 5 người, kêu 5 món, và tổng thiệt hại là 266k",4
